{
  "schema_version": 1,
  "repository_identity": "meridian-rift",
  "repository_revision": "0123456789abcdef0123456789abcdef01234567",
  "dme_identifier": "tgstation.dme",
  "map_target_id": "maps/meridian.dmm",
  "protocol_version": 1,
  "environment_sha256": "aaaaaaaaaaaaaaaaaaaaaaaaaaaaaaaaaaaaaaaaaaaaaaaaaaaaaaaaaaaaaaaa",
  "input_map_sha256": "bbbbbbbbbbbbbbbbbbbbbbbbbbbbbbbbbbbbbbbbbbbbbbbbbbbbbbbbbbbbbbbb",
  "output_map_sha256": "cccccccccccccccccccccccccccccccccccccccccccccccccccccccccccccccc",
  "accepted_revision": 42,
  "content_manifest_sha256": "dddddddddddddddddddddddddddddddddddddddddddddddddddddddddddddddd",
  "producer": {
    "name": "apheliondmm",
    "version": "2.18.0-alpha+aphelion"
  }
}
